"Reino","Filo","Classe","Ordem","Familia","Genero","Especie","Subespecie","Nome_Cientifico_Anterior","Autor","Nome_Comum","Grupo","Mes_Ano_Avaliacao","Categoria","Possivemente_Extinta","Criterio","Justificativa","Endemica_Brasil","Consta_em_Lista_Nacional_Oficial","Estado","Regiao","Bioma","Bacia_Hidrografica","Unidade_de_Conservacao_Federal","Unidade_de_Conservacao_Estadual","RPPN","Migratoria","Tendencia_Populacional","Ameaca","Uso","Acao_Conservacao","Plano_de_Acao","Listas_e_Convencoes","Altitude_min_max_","Barimetria_min_max_"
"Animalia","Arthropoda","Insecta","Hymenoptera","Apidae","Centris","Centris thelyopsis","","","Vivallo & Melo, 2009","Abelha","Invertebrados Terrestres","07/2021","Em Perigo","","B1ab(iii)","Centris thelyopsis é endêmica do Brasil com registros apenas para o município de Teresina de Goiás, estado de Goiás. Considerando sua associação em enclaves de ambientes de Mata Seca, acredita-se que sua distribuição seja, de fato, restrita à sub bacia do Vale do Paranã, cuja área é estimada em 1.900km2. Esta área foi considerada equivalente à sua extensão de ocorrência (EOO). A principal ameaça à espécie é a perda de habitat devido à exploração seletiva de madeira, ocupação por pastagens, ocorrência de incêndios florestais, destruição dos afloramentos pela indústria de mineração. Essas atividades, além de reduzirem e fragmentarem a paisagem natural, também contribuem para o declínio continuado da qualidade do habitat remanescente. Considerando a baixa capacidade de dispersão e a alta dependência por habitats preservados, infere-se que sua população esteja severamente fragmentada. Por essas razões, Centris thelyopsis foi categorizada como Em Perigo (EN) pelo critério B1ab(iii).","Sim","Não","Goiás","|Centro-Oeste|","Cerrado","Sub-bacia Tocantins Alto","","","","Não","Desconhecida","2 - Agropecuária e Aquacultura|2.3 - Pecuária|2.3.4 - Pecuária em escala desconhecida 3 - Produção energética e mineração|3.2 - Mineração|3.2.4 - Extração de minérios - garimpo 5 - Uso de recursos biológicos|5.3 - Extração florestal|5.3.5 - Motivação desconhecida 7 - Modificações nos sistemas naturais|7.1 - Incêndios e supressão de incêndios|7.1.1 - Aumento da frequência/intensidade de incêndios","","Plano de Ação Nacional (PAN)","Plano de Ação Nacional para a Conservação de Insetos Polinizadores","","",""
"Animalia","Arthropoda","Insecta","Hymenoptera","Colletidae","Actenosigynes","Actenosigynes mantiqueirensis","","","Silveira, 2009","Abelha","Invertebrados Terrestres","07/2021","Criticamente em Perigo","Não","B1ab(iii)","Actenosigynes mantiqueirensis é endêmica do Brasil, registrada apenas na porção mineira da Serra da Mantiqueira. A espécie, aparentemente, é associada aos ambientes com dominância de floresta mista de Araucária e parece ser dependente de uma única fonte de pólen, a planta Blumenbachia amana (Loasaceae). A região de ocorrência da espécie, sobretudo as fitofisionomias florestais e campestres da Serra da Mantiqueira, estão sobre forte pressão antrópica há décadas. Atualmente, essas áreas sofrem impactos oriundos da expansão urbana e das atividades agropecuárias da região, que além de causarem perda e fragmentação da paisagem natural, também acarretam no declínio da qualidade do habitat remanescente. A fragmentação ambiental, somada à baixa capacidade de dispersão da espécie e à dependência de apenas uma fonte de pólen, sugerem que a população esteja severamente fragmentada. Por essas razões, Actenosigynes mantiqueirensis foi categorizada como Criticamente Em Perigo (CR), pelo critério B1ab(iii).","Sim","Não","Minas Gerais","|Sudeste|","Mata Atlântica","Sub-bacia Grande","","ÁREA DE PROTEÇÃO AMBIENTAL FERNÃO DIAS","","Não","Desconhecida","11 - Mudanças e extremos climáticos|11.1 - Mudança/alteração de habitat 1 - Desenvolvimento residencial e comercial|1.1 - Expansão urbana 2 - Agropecuária e Aquacultura|2.1 - Culturas anuais e perenes não-madeireiras|2.1.4 - Agricultura de escala desconhecida 2 - Agropecuária e Aquacultura|2.3 - Pecuária|2.3.4 - Pecuária em escala desconhecida","","Plano de Ação Nacional (PAN)","Plano de Ação Nacional para a Conservação de Insetos Polinizadores","","",""
"Animalia","Arthropoda","Insecta","Hymenoptera","Apidae","Partamona","Partamona seridoensis","","Partamona seridoensis","Pedro & Camargo, 2003","Abelha","Invertebrados Terrestres","07/2021","Menos Preocupante","","","Partamona seridoensis é endêmica do Brasil, onde ocorre nos estados do Ceará, Maranhão, Paraíba, Pernambuco, Rio Grande do Norte e Tocantins. Apesar das ameaças identificadas, estas não colocam a espécie em risco de extinção no futuro próximo. Por isso, P. seridoensis foi categorizada como Menos Preocupante (LC).","Sim","Não","Ceará, Maranhão, Paraíba, Pernambuco, Rio Grande do Norte, Tocantins","|Nordeste|Norte|","Amazônia, Caatinga, Cerrado, Mata Atlântica","Sub-bacia Araguaia Sub-bacia Gurupi Sub-bacia Itapecuru Sub-bacia Jaguaribe Sub-bacia Litoral AL PE PB Sub-bacia Litoral CE PB Sub-bacia Litoral CE PI Sub-bacia Mearim Sub-bacia Paraíba Sub-bacia Parnaíba Alto Sub-bacia São Francisco Submédio","APA Delta do Parnaíba, PARNA de Ubajara","ÁREA DE PROTEçãO AMBIENTAL DA FOZ DO RIO DAS PREGUIçAS - PEQUENOS LENçóIS - REGIãO LAGUNAR ADJACENTE, ÁREA DE PROTEçãO AMBIENTAL DAS REENTRâNCIAS MARANHENSES, ÁREA DE PROTEçãO AMBIENTAL DE UPAON-AçU / MIRITIBA / ALTO PREGUIçAS","RPPN Fazenda Santa Clara","Desconhecido","Desconhecida","2 - Agropecuária e Aquacultura|2.1 - Culturas anuais e perenes não-madeireiras|2.1.4 - Agricultura de escala desconhecida 2 - Agropecuária e Aquacultura|2.3 - Pecuária|2.3.4 - Pecuária em escala desconhecida","","","","","",""
"Animalia","Arthropoda","Insecta","Hymenoptera","Apidae","Mourella","Mourella caerulea","","Mourella caerulea","(Friese, 1900)","Abelha, bieira, mirim-do-chão","Invertebrados Terrestres","07/2021","Menos Preocupante","","","Mourella caerulea ocorre no Uruguai, Paraguai, Argentina e Brasil, onde ocorre nos estados do Paraná, Rio Grande do Sul, Santa Catarina e São Paulo. Apesar das ameaças identificadas em parte de sua distribuição, estas não colocam a espécie em risco de extinção no futuro próximo. Por isso, M. caerulea foi categorizada como Menos Preocupante (LC).","Não","Não","Paraná, Rio Grande do Sul, Santa Catarina, São Paulo","|Sudeste|Sul|","Mata Atlântica, Pampa","Sub-bacia Guaíba Sub-bacia Ibicuí Sub-bacia Litoral SP PR SC Sub-bacia Paranapanema Sub-bacia Tietê Sub-bacia Uruguai Alto","PARNA da Serra do Itajaí","APA JUNDIAí","RPPN Fazenda Araucária, RPPN Reserva Particular Professor Delmar Harry dos Reis","Não","Desconhecida","1 - Desenvolvimento residencial e comercial|1.1 - Expansão urbana 2 - Agropecuária e Aquacultura|2.1 - Culturas anuais e perenes não-madeireiras|2.1.4 - Agricultura de escala desconhecida 2 - Agropecuária e Aquacultura|2.3 - Pecuária|2.3.4 - Pecuária em escala desconhecida","","","","","",""
"Animalia","Arthropoda","Insecta","Hymenoptera","Apidae","Lestrimelitta","Lestrimelitta tropica","","Lestrimelitta tropica","Marchi & Melo, 2006","Abelha, Limão","Invertebrados Terrestres","07/2021","Menos Preocupante","","","Lestrimelitta tropica é endêmica do Brasil com registro nos estados da Bahia, Ceará e Rio de Janeiro. Apesar das ameaças identificadas, estas não colocam a espécie em risco de extinção no futuro próximo. Por isso, L. tropica foi categorizada como Menos Preocupante (LC).","Sim","Não","Bahia, Ceará, Rio de Janeiro","|Nordeste|Sudeste|","Caatinga, Mata Atlântica","Sub-bacia Litoral RJ","","","RPPN Fazenda Arco-Íris","Desconhecido","Desconhecida","11 - Mudanças e extremos climáticos|11.1 - Mudança/alteração de habitat 1 - Desenvolvimento residencial e comercial|1.1 - Expansão urbana 2 - Agropecuária e Aquacultura|2.1 - Culturas anuais e perenes não-madeireiras|2.1.4 - Agricultura de escala desconhecida","","Proteção de recursos/habitat","","","",""
"Animalia","Arthropoda","Insecta","Hymenoptera","Apidae","Partamona","Partamona nhambiquara","","Partamona nhambiquara","Pedro & Camargo, 2003","Abelha","Invertebrados Terrestres","07/2021","Menos Preocupante","","","Partamona nhambiquara ocorre na Bolívia e no Brasil, sendo registrada nos estados do Pará, Rondônia, Goiás e Mato Grosso. Não foram identificadas ameaças que coloquem a espécie em risco de extinção no futuro próximo. Por isso, P. nhambiquara foi categorizada como Menos Preocupante (LC).","Não","Não","Goiás, Mato Grosso, Pará, Rondônia","|Centro-Oeste|Norte|","Amazônia, Cerrado","Sub-bacia Araguaia Sub-bacia Madeira Sub-bacia Paranaíba Sub-bacia Tocantins Baixo","FLONA Crepori, RESEX Barreiro das Antas, RESEX Lago do Cuniã","ÁREA DE PROTEÇÃO AMBIENTAL DA CHAPADA DOS GUIMARÃES, PARQUE ESTADUAL DE GUAJARÁ-MIRIM, RESERVA EXTRATIVISTA RIO CAUTÁRIO","RPPN Parque Natural Leonildo Ferreira 1, RPPN Reserva Ecológica da Mata Fria","Desconhecido","Desconhecida","","","","","","",""
"Animalia","Arthropoda","Insecta","Hymenoptera","Apidae","Frieseomelitta","Frieseomelitta flavicornis","","Frieseomelitta flavicornis","(Fabricius, 1798)","Abelha","Invertebrados Terrestres","07/2021","Menos Preocupante","","","Frieseomelitta flavicornis ocorre no Peru, Bolívia, Guiana, Guiana Francesa, Suriname e Brasil, sendo registrada nos estados do Amapá, Amazonas, Pará e Roraima. Apesar das ameaças identificadas em parte de sua distribuição, estas não colocam a espécie em risco de extinção no futuro próximo. Por isso, F. flavicornis foi categorizada como Menos Preocupante (LC)","Não","Não","Amapá, Amazonas, Pará, Roraima","|Norte|","Amazônia","Sub-bacia Amapá Litoral Sub-bacia Negro Sub-bacia Tocantins Baixo","ESEC Juami-Japurá, FLONA Carajás, PARNA Jaú, PARNA Montanhas do Tumucumaque","","","Não","Desconhecida","2 - Agropecuária e Aquacultura|2.1 - Culturas anuais e perenes não-madeireiras|2.1.4 - Agricultura de escala desconhecida 2 - Agropecuária e Aquacultura|2.3 - Pecuária|2.3.4 - Pecuária em escala desconhecida","1 - Alimentação humana|1.4 - Produção de mel e subprodutos","","","","",""
"Animalia","Arthropoda","Insecta","Hymenoptera","Apidae","Ptilotrigona","Ptilotrigona perenae","","Ptilotrigona perenae","(Schwarz, 1943)","Abelha","Invertebrados Terrestres","07/2021","Menos Preocupante","","","Ptilotrigona perenae ocorre na Colômbia, Equador, Peru e Brasil, sendo registrada nos estados do Acre e Amazonas. Apesar das ameaças identificadas, estas não colocam a espécie em risco de extinção no futuro próximo. Por isso, P. perenae foi categorizada como Menos Preocupante (LC).","Não","Não","Acre, Amazonas","|Norte|","Amazônia","","PARNA Serra do Divisor","","","Desconhecido","Desconhecida","2 - Agropecuária e Aquacultura|2.1 - Culturas anuais e perenes não-madeireiras|2.1.4 - Agricultura de escala desconhecida 2 - Agropecuária e Aquacultura|2.3 - Pecuária|2.3.4 - Pecuária em escala desconhecida","","","","","",""
"Animalia","Arthropoda","Insecta","Hymenoptera","Apidae","Euglossa","Euglossa violaceifrons","","","Rebelo & Moure, 1996","Abelha das orquídeas","Invertebrados Terrestres","07/2021","Menos Preocupante","","","Euglossa violaceifrons é endêmica do Brasil com registros para a Bahia, Pernambuco, Paraíba, Espírito Santo, Minas Gerais, Rio de Janeiro e São Paulo. Não foram identificadas ameaças que coloquem a espécie em risco de extinção no futuro próximo. Por isso, E. violaceifrons foi categorizada como Menos Preocupante (LC).","Sim","Não","Bahia, Espírito Santo, Minas Gerais, Paraíba, Pernambuco, Rio de Janeiro, São Paulo","|Nordeste|Sudeste|","Caatinga, Cerrado, Mata Atlântica","Sub-bacia Doce Sub-bacia Grande Sub-bacia Litoral AL PE PB Sub-bacia Litoral CE PB Sub-bacia Litoral RJ Sub-bacia São Francisco Alto Sub-bacia São Francisco Médio","APA Bacia do Rio São João/Mico-Leão-Dourado","ESTAÇÃO ECOLÓGICA ESTADUAL DE GUAXINDIBA, PARQUE ESTADUAL DO RIO DOCE","RPPN Feliciano Miguel Abdala","Não","Desconhecida","","","","","","",""
"Animalia","Arthropoda","Insecta","Hymenoptera","Apidae","Melipona","Melipona tumupasae","","Melipona tumupasae","(Schwarz, 1932)","Abelha","Invertebrados Terrestres","07/2021","Menos Preocupante","","","Melipona tumupasae ocorre na Bolívia, Peru e Brasil, onde é registrada no estado do Acre. Não foram identificadas ameaças que coloquem a espécie em risco de extinção no futuro próximo. Por isso, M. tumupasae foi categorizada como Menos Preocupante (LC).","Não","Não","Acre","|Norte|","Amazônia","","PARNA Serra do Divisor","","","Desconhecido","Desconhecida","","","","","","",""
"Animalia","Arthropoda","Insecta","Hymenoptera","Apidae","Partamona","Partamona testacea","","Partamona testacea","(Klug, 1807)","Abelha, Cupira-amarela","Invertebrados Terrestres","07/2021","Menos Preocupante","","","Partamona testacea ocorre na Bolívia, Colômbia, Equador, Guiana Francesa, Peru, Suriname e Brasil, sendo registrada nos estados do Acre, Amazonas, Amapá, Ceará, Maranhão, Pará e Rondônia. Apesar das ameaças identificadas, estas não colocam a espécie em risco de extinção no futuro próximo. Por isso, P. testacea foi categorizada como Menos Preocupante (LC).","Não","Não","Acre, Amapá, Amazonas, Ceará, Maranhão, Pará, Rondônia","|Nordeste|Norte|","Amazônia, Caatinga, Cerrado","Sub-bacia Amapá Litoral Sub-bacia Gurupi Sub-bacia Litoral CE PI Sub-bacia Madeira Sub-bacia Mearim Sub-bacia Negro Sub-bacia Parnaíba Baixo Sub-bacia Paru Sub-bacia Tocantins Alto Sub-bacia Tocantins Baixo Sub-bacia Xingu","ESEC Juami-Japurá, FLONA Carajás, PARNA de Ubajara, PARNA dos Campos Ferruginosos, PARNA Serra do Divisor, RESEX Alto Juruá, RESEX Baixo Juruá, RESEX Rio Unini","PARQUE ESTADUAL DE GUAJARÁ-MIRIM","RPPN Laço de Amor, RPPN Seringal Assunção","Desconhecido","Desconhecida","2 - Agropecuária e Aquacultura|2.1 - Culturas anuais e perenes não-madeireiras|2.1.4 - Agricultura de escala desconhecida 2 - Agropecuária e Aquacultura|2.3 - Pecuária|2.3.4 - Pecuária em escala desconhecida","","","","","",""
"Animalia","Arthropoda","Insecta","Hymenoptera","Apidae","Paratrigona","Paratrigona catabolonota","","Paratrigona catabolonota","Camargo & Moure, 1994","Abelha","Invertebrados Terrestres","07/2021","Menos Preocupante","","","Paratrigona catabolonota é endêmica do Brasil, onde ocorre no estado da Amazonas. Não foram identificadas ameaças que coloquem a espécie em risco de extinção no futuro próximo. Por isso, P. catabolonota foi categorizada como Menos Preocupante (LC).","Sim","Não","Amazonas","|Norte|","Amazônia","","","RESERVA DE DESENVOLVIMENTO SUSTENTÁVEL MAMIRAUÁ","","Desconhecido","Desconhecida","","","","","","",""
"Animalia","Arthropoda","Insecta","Hymenoptera","Apidae","Lestrimelitta","Lestrimelitta monodonta","","Lestrimelitta monodonta","Camargo & Moure, 1989","Abelha","Invertebrados Terrestres","07/2021","Menos Preocupante","","","Lestrimelitta monodonta é endêmica do Brasil, onde ocorre nos estados do Amazonas, Maranhão, Pará, Rondônia e Roraima. Apesar das ameaças identificadas em parte de sua distribuição, estas não colocam a espécie em risco de extinção no futuro próximo. Por isso, L. monodonta foi categorizada como Menos Preocupante (LC).","Sim","Não","Amazonas, Maranhão, Pará, Rondônia, Roraima","|Nordeste|Norte|","Amazônia, Cerrado","Sub-bacia Itapecuru Sub-bacia Negro Sub-bacia Tocantins Baixo","","ÁREA DE PROTEÇÃO AMBIENTAL DO LAGO DE TUCURUI, RESERVA DE DESENVOLVIMENTO SUSTENTÁVEL ALCOBAÇA","","Desconhecido","Desconhecida","2 - Agropecuária e Aquacultura|2.1 - Culturas anuais e perenes não-madeireiras|2.1.4 - Agricultura de escala desconhecida 2 - Agropecuária e Aquacultura|2.3 - Pecuária|2.3.4 - Pecuária em escala desconhecida","","","","","",""
"Animalia","Arthropoda","Insecta","Hymenoptera","Apidae","Paratrigona","Paratrigona melanaspis","","Paratrigona melanaspis","Camargo & Moure, 1994","Abelha","Invertebrados Terrestres","07/2021","Menos Preocupante","","","Paratrigona melanaspis é endêmica do Brasil, onde ocorre no estado do Amazonas. Apesar das ameaças identificadas, estas não colocam a espécie em risco de extinção no futuro próximo. Por isso, P. melanaspis foi categorizada como Menos Preocupante (LC).","Sim","Não","Amazonas","|Norte|","Amazônia","Sub-bacia Negro","","","","Desconhecido","Desconhecida","7 - Modificações nos sistemas naturais|7.3 - Outras modificações nos ecossistemas","","","","","",""
"Animalia","Arthropoda","Insecta","Hymenoptera","Apidae","Tetragona","Tetragona goettei","","Tetragona goettei","(Friese, 1900)","Abelha, Mehr-xi-we'i, Shawa-puiki-buná, Tataíra-pequena","Invertebrados Terrestres","07/2021","Menos Preocupante","","","Tetragona goettei ocorre na Bolívia, Colômbia, Peru e no Brasil, onde ocorre nos estados do Acre, Amazonas, Maranhão, Mato Grosso, Pará, Rondônia e Roraima. Apesar das ameaças identificadas, estas não colocam a espécie em risco de extinção no futuro próximo. Por isso, T. goettei foi categorizada como Menos Preocupante (LC).","Não","Não","Acre, Amazonas, Maranhão, Mato Grosso, Pará, Rondônia, Roraima","|Centro-Oeste|Nordeste|Norte|","Amazônia, Cerrado","Sub-bacia Gurupi Sub-bacia Itapecuru Sub-bacia Madeira Sub-bacia Mearim Sub-bacia Negro Sub-bacia Tocantins Baixo Sub-bacia Xingu","APA Tapajós, ESEC Cuniã, FLONA Carajás, FLONA Jacundá, FLONA Jamari, PARNA dos Campos Ferruginosos, REBIO do Jaru, RESEX Rio Cautário, RESEX Rio Ouro Preto","ÁREA DE PROTEçãO AMBIENTAL DE UPAON-AçU / MIRITIBA / ALTO PREGUIçAS, PARQUE ESTADUAL DE GUAJARÁ-MIRIM, PARQUE ESTADUAL SERRA DOS REIS, RESERVA DE DESENVOLVIMENTO SUSTENTÁVEL AMANÃ, RESERVA DE DESENVOLVIMENTO SUSTENTÁVEL MAMIRAUÁ, RESERVA EXTRATIVISTA MARACATIARA, RESERVA EXTRATIVISTA RIO CAUTÁRIO","RPPN Laço de Amor, RPPN Seringal Assunção","Desconhecido","Desconhecida","2 - Agropecuária e Aquacultura|2.1 - Culturas anuais e perenes não-madeireiras|2.1.4 - Agricultura de escala desconhecida 2 - Agropecuária e Aquacultura|2.3 - Pecuária|2.3.4 - Pecuária em escala desconhecida","1 - Alimentação humana|1.4 - Produção de mel e subprodutos","","","","",""
"Animalia","Arthropoda","Insecta","Hymenoptera","Apidae","Melipona","Melipona illustris","","Melipona illustris","Schwarz, 1932","Abelha","Invertebrados Terrestres","07/2021","Menos Preocupante","","","Melipona illustris ocorre na Venezuela, Suriname e Brasil, onde ocorre nos estados do Acre, Amazonas, Amapá, Mato Grosso do Sul, Mato Grosso, Pará, Rondônia e Roraima. Não foram identificadas ameaças que coloquem a espécie em risco de extinção no futuro próximo. Por isso, M. illustris foi categorizada como Menos Preocupante (LC).","Não","Não","Acre, Amapá, Amazonas, Mato Grosso, Mato Grosso do Sul, Pará, Rondônia, Roraima","|Centro-Oeste|Norte|","Amazônia, Pantanal","Sub-bacia Amapá Litoral Sub-bacia Madeira Sub-bacia Negro","PARNA Juruena, RESEX Rio Unini","PARQUE ESTADUAL DE GUAJARÁ-MIRIM, RESERVA DE DESENVOLVIMENTO SUSTENTÁVEL MAMIRAUÁ, RESERVA DE DESENVOLVIMENTO SUSTENTÁVEL PIAGAÇU PURUS, RESERVA EXTRATIVISTA RIO CAUTÁRIO","RPPN Arara Azul, RPPN Laço de Amor","Desconhecido","Desconhecida","","","","","","",""
"Animalia","Arthropoda","Insecta","Hymenoptera","Apidae","Aparatrigona","Aparatrigona impunctata","","Aparatrigona impunctata","(Ducke, A. 1916)","Abelha","Invertebrados Terrestres","07/2021","Menos Preocupante","","","Aparatrigona impuctata tem distribuição natural no domínio Amazônico, com registros para o Brasil, Colômbia, Equador, Guiana Francesa, Guiana, Peru e Suriname. No Brasil ocorre nos estados do Acre, Amazonas, Amapá, Maranhão, Mato Grosso, Pará, Rondônia e Roraima. Apesar das ameaças identificadas em parte de sua distribuição, estas não colocam a espécie em risco de extinção no futuro próximo. Por isso, A. impunctata foi categorizada como Menos Preocupante (LC).","Não","Não","Acre, Amapá, Amazonas, Maranhão, Mato Grosso, Pará, Rondônia, Roraima","|Centro-Oeste|Nordeste|Norte|","Amazônia, Cerrado","Sub-bacia Amapá Litoral Sub-bacia Araguaia Sub-bacia Gurupi Sub-bacia Madeira Sub-bacia Mearim Sub-bacia Negro Sub-bacia Tocantins Alto Sub-bacia Tocantins Baixo Sub-bacia Xingu","FLONA Carajás, PARNA dos Campos Ferruginosos, RESEX Baixo Juruá, RESEX Médio Juruá","ÁREA DE PROTEçãO AMBIENTAL DAS REENTRâNCIAS MARANHENSES, ÁREA DE PROTEÇÃO AMBIENTAL MARGEM DIREITA DO RIO NEGRO- SETOR PADUARI-SOLIMÕES, PARQUE ESTADUAL CHANDLESS, PARQUE ESTADUAL SERRA DOS REIS, PARQUE ESTADUAL Zé BOLO FLô, RESERVA DE DESENVOLVIMENTO SUSTENTÁVEL MAMIRAUÁ","RPPN Laço de Amor","Desconhecido","Desconhecida","2 - Agropecuária e Aquacultura|2.1 - Culturas anuais e perenes não-madeireiras|2.1.4 - Agricultura de escala desconhecida 2 - Agropecuária e Aquacultura|2.3 - Pecuária|2.3.4 - Pecuária em escala desconhecida","","Empreendimentos \"sustentáveis\"","","","",""
"Animalia","Arthropoda","Insecta","Hymenoptera","Apidae","Trigona","Trigona cilipes","","Trigona cilipes","(Fabricius, 1804)","Abelha, Angelita, Buhnide, Mehnôrá-kamrek","Invertebrados Terrestres","07/2021","Menos Preocupante","","","Trigona cilipes é amplamente distribuída na América do Sul, ocorrendo na Bolívia, Colômbia, Costa Rica, Equador, Guiana Francesa, Guiana, Panamá, Peru, Suriname, Venezuela e Brasil, onde é registrada nos estados do Acre, Amazonas, Amapá, Goiás, Maranhão, Mato Grosso, Pará, Paraíba, Rondônia e Roraima. Apesar das ameaças identificadas, estas não colocam a espécie em risco de extinção no futuro próximo. Por isso, T. cilipes foi categorizada como Menos Preocupante (LC).","Não","Não","Acre, Amapá, Amazonas, Goiás, Maranhão, Mato Grosso, Pará, Rondônia, Roraima","|Centro-Oeste|Nordeste|Norte|","Amazônia, Cerrado, Pantanal","Sub-bacia Amapá Litoral Sub-bacia Araguaia Sub-bacia Itapecuru Sub-bacia Madeira Sub-bacia Mearim Sub-bacia Negro Sub-bacia Paru Sub-bacia Tocantins Alto Sub-bacia Tocantins Baixo Sub-bacia Xingu","FLONA Carajás, PARNA Juruena, PARNA Pico da Neblina","ÁREA DE PROTEçãO AMBIENTAL DAS REENTRâNCIAS MARANHENSES, ÁREA DE PROTEÇÃO AMBIENTAL TRIUNFO DO XINGU, FLORESTA ESTADUAL DO TROMBETAS, PARQUE ESTADUAL DE GUAJARÁ-MIRIM, RESERVA DE DESENVOLVIMENTO SUSTENTÁVEL CUJUBIM","RPPN Jubran, RPPN Laço de Amor","Não","Desconhecida","2 - Agropecuária e Aquacultura|2.1 - Culturas anuais e perenes não-madeireiras|2.1.4 - Agricultura de escala desconhecida 2 - Agropecuária e Aquacultura|2.3 - Pecuária|2.3.4 - Pecuária em escala desconhecida","","","","","",""
"Animalia","Arthropoda","Insecta","Hymenoptera","Apidae","Melipona","Melipona grandis","","Melipona grandis","Guérin, 1844","Abelha, buná-bissu, guare, patchumepube, preto-maior, rajadinho-maior, uruçu-cinzento","Invertebrados Terrestres","07/2021","Menos Preocupante","","","Melipona grandis ocorre na Bolívia, Colômbia, Peru, Equador e Brasil, onde ocorre nos estados do Acre, Amazonas, Mato Grosso, Rondônia. Apesar das ameaças identificadas em parte de sua distribuição, estas não colocam a espécie em risco de extinção no futuro próximo. Por isso, M. grandis foi categorizada como Menos Preocupante (LC).","Não","Não","Acre, Amazonas, Mato Grosso, Rondônia","|Centro-Oeste|Norte|","Amazônia","Sub-bacia Madeira Sub-bacia Negro","RESEX Alto Juruá, RESEX Lago do Cuniã, RESEX Rio Ouro Preto","RESERVA DE DESENVOLVIMENTO SUSTENTÁVEL MAMIRAUÁ, RESERVA EXTRATIVISTA RIO CAUTÁRIO","RPPN Laço de Amor, RPPN Seringal Assunção","Desconhecido","Desconhecida","2 - Agropecuária e Aquacultura|2.1 - Culturas anuais e perenes não-madeireiras|2.1.4 - Agricultura de escala desconhecida 2 - Agropecuária e Aquacultura|2.3 - Pecuária|2.3.4 - Pecuária em escala desconhecida","","","","","",""
"Animalia","Arthropoda","Insecta","Hymenoptera","Apidae","Trigona","Trigona dallatorreana","","Trigona dallatorreana","Friese, 1900","Abelha, Sicae-amarilla-chica, Tu","Invertebrados Terrestres","07/2021","Menos Preocupante","","","Trigona dallatorreana é amplamente distribuída na América do Sul, ocorrendo na Bolívia, Colômbia, Guiana, Peru, Suriname, Venezuela e Brasil, onde é registrada nos estados da Amazônia: Acre, Amapá, Amazonas, Maranhão, Mato Grosso, Pará, Rondônia, Roraima e Tocantins. Não foram identificadas ameaças que coloquem a espécie em risco de extinção no futuro próximo. Por isso, T. dallatorreana foi categorizada como Menos Preocupante (LC).","Não","Não","Acre, Amapá, Amazonas, Maranhão, Mato Grosso, Pará, Rondônia, Roraima, Tocantins","|Centro-Oeste|Nordeste|Norte|","Amazônia, Cerrado","Sub-bacia Amapá Litoral Sub-bacia Gurupi Sub-bacia Itapecuru Sub-bacia Madeira Sub-bacia Mearim Sub-bacia Negro Sub-bacia Tocantins Baixo Sub-bacia Xingu","ESEC Juami-Japurá, ESEC Jutaí-Solimões, FLONA Carajás, PARNA dos Campos Ferruginosos, PARNA Pico da Neblina, RESEX Alto Juruá, RESEX Rio Cautário, RESEX Rio Unini","ÁREA DE PROTEÇÃO AMBIENTAL DA CHAPADA DOS GUIMARÃES, ÁREA DE PROTEçãO AMBIENTAL DAS REENTRâNCIAS MARANHENSES, ÁREA DE PROTEÇÃO AMBIENTAL MARGEM DIREITA DO RIO NEGRO- SETOR PADUARI-SOLIMÕES, ÁREA DE PROTEÇÃO AMBIENTAL TRIUNFO DO XINGU, PARQUE ESTADUAL DE GUAJARÁ-MIRIM, RESERVA DE DESENVOLVIMENTO SUSTENTÁVEL AMANÃ, RESERVA DE DESENVOLVIMENTO SUSTENTÁVEL MAMIRAUÁ","RPPN Laço de Amor","Desconhecido","Desconhecida","","","","","","",""
